<?xml version="1.0" encoding="UTF-8"?><!ELEMENT PrinterName         (#PCDATA)><!ELEMENT Destination         (#PCDATA)><!ELEMENT Command             (#PCDATA)><!ELEMENT Renameing           (#PCDATA)><!ELEMENT Name                (#PCDATA)><!ELEMENT FirstName           (#PCDATA)><!ELEMENT Address             (#PCDATA)><!ELEMENT Subject             (#PCDATA)><!ELEMENT Text                (#PCDATA)><!-- open declaration   <!ELEMENT Text                ANY>--><!-- Example from a mixed content; No other possibility to define it; PCDATA has to be first element--><!ELEMENT Comment		 (#PCDATA | bold | italic | underline)*><!ELEMENT bold      		   (#PCDATA)><!ELEMENT italic      		 (#PCDATA)><!ELEMENT underline 		   (#PCDATA)><!ENTITY % convertionList "PDF | PS | ASC"><!ATTLIST Destination	protokol (ftp)       #REQUIRED	node CDATA           #REQUIRED	user CDATA           #REQUIRED	password CDATA       #REQUIRED	convertion CDATA     #REQUIRED	destinationDir CDATA #REQUIRED><!ATTLIST PrinterName convertion (%convertionList;) #REQUIRED><!ATTLIST TransferDestination                                        protokol            (ftp) #REQUIRED                                       node                CDATA #REQUIRED                                      user                CDATA #REQUIRED                                      password            CDATA #REQUIRED                                      convertion          CDATA #REQUIRED                                      destinationDir      CDATA #REQUIRED><!ATTLIST Receiver      type (asExcelAttachment |                              asPdfAttachment   |                              asAsciiAttachment |                              asAscii)            #REQUIRED><!ELEMENT FileTransfer (TransferDestination+)><!ELEMENT TransferDestination (PreAction?,Renameing?,PostAction?)><!--    CardinalitÃ¤t: 	? => 0,1						* => 0..n						+ => 1..n--><!ELEMENT PreAction (Command+)><!ELEMENT PostAction (Command+)><!ELEMENT Printing (PrinterName+)><!ELEMENT Email       (Receiver+)><!ELEMENT Receiver (FullName,Address,Subject,Text)><!ELEMENT FullName ((Name,FirstName,MiddleName) | (FirstName,MiddleName,Name) ) ><!ELEMENT MiddleName EMPTY>  <!-- definition of an empty tag.  ANY declaration of beliebigen Inhalt--><!ELEMENT DestinationDescription (FileTransfer?,Printing?,Email?,Comment)>